{
  "$schema": "../../schema/official-source-receipts.schema.json",
  "catalogVersion": "2026-07-11",
  "sourceCount": 38,
  "sources": [
    {
      "annex": 1,
      "attachmentNo": "10004184",
      "bytes": 612234,
      "id": "kr-nec-2026-1-annex1",
      "localFile": "sources/official/files/kr-nec-2026-1-annex1.pdf",
      "originalName": "(2022 개정) 초·중등학교 교육과정 [별책1] 총론_ 국가교육위원회 고시 제2026-1호(2026.1.21.).pdf",
      "pdfPages": 59,
      "sha256": "343e41fa969209381eabebcc8cf852e4e37d91810cf59e7b8f25cb71285ef9af",
      "textFile": "sources/official/text/kr-nec-2026-1-annex1.txt"
    },
    {
      "annex": 3,
      "attachmentNo": "10004186",
      "bytes": 8465750,
      "id": "kr-nec-2026-1-annex3",
      "localFile": "sources/official/files/kr-nec-2026-1-annex3.pdf",
      "originalName": "(2022 개정) 초·중등학교 교육과정 [별책3] 중학교_ 국가교육위원회 고시 제2026-1호(2026.1.21.).pdf",
      "pdfPages": 683,
      "sha256": "69da64aadd460e3889a38377d595adbe08f7fdf96f66517b23813b630702feae",
      "textFile": "sources/official/text/kr-nec-2026-1-annex3.txt"
    },
    {
      "annex": 4,
      "attachmentNo": "10004190",
      "bytes": 18332068,
      "id": "kr-nec-2026-1-annex4",
      "localFile": "sources/official/files/kr-nec-2026-1-annex4.pdf",
      "originalName": "(2022 개정) 초·중등학교 교육과정 [별책4] 고등학교_ 국가교육위원회 제2026-1호(2026.1.21.).pdf",
      "pdfPages": 2215,
      "sha256": "88a513e227ae6071ffe6d9dda93948c9837cc48e8b53cb6007114d10200200b7",
      "textFile": "sources/official/text/kr-nec-2026-1-annex4.txt"
    },
    {
      "annex": 5,
      "attachmentNo": "10003553",
      "bytes": 2078590,
      "id": "kr-moe-2022-33-annex5",
      "localFile": "sources/official/files/kr-moe-2022-33-annex5.pdf",
      "originalName": "[별책5] 국어과 교육과정.pdf",
      "pdfPages": 222,
      "sha256": "5c30ae42a973a8f912bae156b160cd16d56636b3a64af84c3bdc378c9b482544",
      "textFile": "sources/official/text/kr-moe-2022-33-annex5.txt"
    },
    {
      "annex": 6,
      "attachmentNo": "10003738",
      "bytes": 1412105,
      "id": "kr-moe-2022-33-annex6",
      "localFile": "sources/official/files/kr-moe-2022-33-annex6.pdf",
      "originalName": "[별책6] 도덕과 교육과정.pdf",
      "pdfPages": 92,
      "sha256": "0682710d786a0be26efdfbd835195e4871c71bc7c3c11f71427c7087c07a850e",
      "textFile": "sources/official/text/kr-moe-2022-33-annex6.txt"
    },
    {
      "annex": 7,
      "attachmentNo": "10003993",
      "bytes": 4253192,
      "id": "kr-nec-2024-3-annex7",
      "localFile": "sources/official/files/kr-nec-2024-3-annex7.pdf",
      "originalName": "(2022개정) 초·중등학교 교육과정 [별책7] 사회과_ 국가교육위원회 고시 제2024-3호(2024.08.16.).pdf",
      "pdfPages": 317,
      "sha256": "7383ec75add6dae0d1c2138ecfe36dc2c762ab980a96db4aafccface33979e06",
      "textFile": "sources/official/text/kr-nec-2024-3-annex7.txt"
    },
    {
      "annex": 8,
      "attachmentNo": "10003559",
      "bytes": 1938993,
      "id": "kr-moe-2022-33-annex8",
      "localFile": "sources/official/files/kr-moe-2022-33-annex8.pdf",
      "originalName": "[별책8] 수학과 교육과정.pdf",
      "pdfPages": 263,
      "sha256": "ba7c7c63ad31ba0fd32e5eb8148d696dd73288acce111495c593298112f8f840",
      "textFile": "sources/official/text/kr-moe-2022-33-annex8.txt"
    },
    {
      "annex": 9,
      "attachmentNo": "10004171",
      "bytes": 2663278,
      "id": "kr-nec-2024-3-annex9",
      "localFile": "sources/official/files/kr-nec-2024-3-annex9.pdf",
      "originalName": "[별책9] 과학과 교육과정.pdf",
      "pdfPages": 292,
      "sha256": "0cf53427691d54366d6805767c428a15b0e817580807b4354947de7e3b58b738",
      "textFile": "sources/official/text/kr-nec-2024-3-annex9.txt"
    },
    {
      "annex": 10,
      "attachmentNo": "10003781",
      "bytes": 2956125,
      "id": "kr-moe-2022-33-annex10",
      "localFile": "sources/official/files/kr-moe-2022-33-annex10.pdf",
      "originalName": "[별책10] 실과(기술가정)정보과 교육과정.pdf",
      "pdfPages": 222,
      "sha256": "842077c76b311f23d57e6e749a8e4ffbb3d59d37628c1646531301022cc36bfd",
      "textFile": "sources/official/text/kr-moe-2022-33-annex10.txt"
    },
    {
      "annex": 11,
      "attachmentNo": "10003695",
      "bytes": 2371909,
      "id": "kr-moe-2022-33-annex11",
      "localFile": "sources/official/files/kr-moe-2022-33-annex11.pdf",
      "originalName": "[별책11] 체육과 교육과정.pdf",
      "pdfPages": 125,
      "sha256": "49cdef2bbcdf1decb796204ab66a0b6a308cd2903ead7168dde892b1f48cf2fb",
      "textFile": "sources/official/text/kr-moe-2022-33-annex11.txt"
    },
    {
      "annex": 12,
      "attachmentNo": "10003999",
      "bytes": 1943652,
      "id": "kr-nec-2024-3-annex12",
      "localFile": "sources/official/files/kr-nec-2024-3-annex12.pdf",
      "originalName": "(2022개정) 초·중등학교 교육과정 [별책12] 음악과_ 국가교육위원회 고시 제2024-3호(2024.08.16.).pdf",
      "pdfPages": 96,
      "sha256": "54af8340687ace3599f5242dcc6d4d95382af24144be186fa6c4b246417d0487",
      "textFile": "sources/official/text/kr-nec-2024-3-annex12.txt"
    },
    {
      "annex": 13,
      "attachmentNo": "10003555",
      "bytes": 1983114,
      "id": "kr-moe-2022-33-annex13",
      "localFile": "sources/official/files/kr-moe-2022-33-annex13.pdf",
      "originalName": "[별책13] 미술과 교육과정.pdf",
      "pdfPages": 76,
      "sha256": "b47363c9a1060b00777c6de555d972b509b64b886d7beca89460a552a33c77b2",
      "textFile": "sources/official/text/kr-moe-2022-33-annex13.txt"
    },
    {
      "annex": 14,
      "attachmentNo": "10004085",
      "bytes": 2719273,
      "id": "kr-nec-2024-3-annex14",
      "localFile": "sources/official/files/kr-nec-2024-3-annex14.pdf",
      "originalName": "(2022개정)초·중등학교교육과정[별책14]영어과_국가교육위원회고시제2024-3호(2024.08.16.).pdf",
      "pdfPages": 306,
      "sha256": "7f0ada9d732b475b2c64d45ea8b066cc8a78d3cf6c1368640b9b8943e1453331",
      "textFile": "sources/official/text/kr-nec-2024-3-annex14.txt"
    },
    {
      "annex": 16,
      "attachmentNo": "10003762",
      "bytes": 9552384,
      "id": "kr-moe-2022-33-annex16",
      "localFile": "sources/official/files/kr-moe-2022-33-annex16.pdf",
      "originalName": "[별책16] 제2외국어과 교육과정.pdf",
      "pdfPages": 670,
      "sha256": "442629889f75ad2f8544936008b445b46a42ea3e54786c8f57b7e764be920339",
      "textFile": "sources/official/text/kr-moe-2022-33-annex16.txt"
    },
    {
      "annex": 17,
      "attachmentNo": "10003750",
      "bytes": 1799702,
      "id": "kr-moe-2022-33-annex17",
      "localFile": "sources/official/files/kr-moe-2022-33-annex17.pdf",
      "originalName": "[별책17] 한문과 교육과정.pdf",
      "pdfPages": 63,
      "sha256": "e3466e192e1e3943b669ff627ae19c5f223d7f0fb8b2c52fe7bac63be13d7301",
      "textFile": "sources/official/text/kr-moe-2022-33-annex17.txt"
    },
    {
      "annex": 18,
      "attachmentNo": "10004037",
      "bytes": 1387377,
      "id": "kr-nec-2024-3-annex18",
      "localFile": "sources/official/files/kr-nec-2024-3-annex18.pdf",
      "originalName": "(2022개정) 초·중등학교 교육과정 [별책18] 중학교 선택교과_국가교육위원회 고시 제2024-3호(2024.08.16.).pdf",
      "pdfPages": 65,
      "sha256": "fd13a91d11285d581b263aeac70381002f53407faf764316a3fc51d613f3f7d8",
      "textFile": "sources/official/text/kr-nec-2024-3-annex18.txt"
    },
    {
      "annex": 19,
      "attachmentNo": "10003991",
      "bytes": 2768500,
      "id": "kr-nec-2024-3-annex19",
      "localFile": "sources/official/files/kr-nec-2024-3-annex19.pdf",
      "originalName": "(2022개정) 초·중등학교 교육과정 [별책19] 고등학교 교양 교과_국가교육위원회 고시 제2024-3호(2024.08.16.).pdf",
      "pdfPages": 159,
      "sha256": "b8b903fbee60581e8f4f19e1c2a510d4ed680093fe2ea04908e3eb3090697db7",
      "textFile": "sources/official/text/kr-nec-2024-3-annex19.txt"
    },
    {
      "annex": 20,
      "attachmentNo": "10003683",
      "bytes": 1703680,
      "id": "kr-moe-2022-33-annex20",
      "localFile": "sources/official/files/kr-moe-2022-33-annex20.pdf",
      "originalName": "[별책20] 과학 계열 선택 과목 교육과정.pdf",
      "pdfPages": 192,
      "sha256": "efe03e71806e48e92855d24121e016ba9e911947f9b36fc6c5ab3b8b310a4ab7",
      "textFile": "sources/official/text/kr-moe-2022-33-annex20.txt"
    },
    {
      "annex": 21,
      "attachmentNo": "10003685",
      "bytes": 1343173,
      "id": "kr-moe-2022-33-annex21",
      "localFile": "sources/official/files/kr-moe-2022-33-annex21.pdf",
      "originalName": "[별책21] 체육 계열 선택 과목 교육과정.pdf",
      "pdfPages": 106,
      "sha256": "a5a611a2db27aea9d8b2623ce3aaabff4317fd3bfb033740400d6e4a5afc90da",
      "textFile": "sources/official/text/kr-moe-2022-33-annex21.txt"
    },
    {
      "annex": 22,
      "attachmentNo": "10003997",
      "bytes": 5910393,
      "id": "kr-nec-2024-3-annex22",
      "localFile": "sources/official/files/kr-nec-2024-3-annex22.pdf",
      "originalName": "(2022개정) 초·중등학교 교육과정 [별책22] 예술계열 선택 과목_국가교육위원회 고시 제2024-3호(2024.08.16.).pdf",
      "pdfPages": 536,
      "sha256": "bd2c67f5e25ddbf01f6db26af656c2e123de1d45211032090167ca9fe8e067dc",
      "textFile": "sources/official/text/kr-nec-2024-3-annex22.txt"
    },
    {
      "annex": 23,
      "attachmentNo": "10004130",
      "bytes": 7201613,
      "id": "kr-nec-2024-3-annex23",
      "localFile": "sources/official/files/kr-nec-2024-3-annex23.pdf",
      "originalName": "(2022개정)초·중등학교교육과정[별책23]경영·금융전문교과__국가교육위원회고시제2024-3호(2024.08.16.).pdf",
      "pdfPages": 619,
      "sha256": "1d05f9f703587e48a4f760c2a8425e022433e66d620b0c7f8a2f0fdaade3ebbd",
      "textFile": "sources/official/text/kr-nec-2024-3-annex23.txt"
    },
    {
      "annex": 24,
      "attachmentNo": "10004132",
      "bytes": 3513657,
      "id": "kr-nec-2024-3-annex24",
      "localFile": "sources/official/files/kr-nec-2024-3-annex24.pdf",
      "originalName": "(2022개정)초·중등학교교육과정[별책24]보건·복지전문교과_국가교육위원회고시제2024-3호(2024.08.16.).pdf",
      "pdfPages": 317,
      "sha256": "9ab5651c94164af467b95b99fae499e53d11a4fcaa2efbb75673a04d2defd719",
      "textFile": "sources/official/text/kr-nec-2024-3-annex24.txt"
    },
    {
      "annex": 25,
      "attachmentNo": "10004094",
      "bytes": 9605543,